{"decision_tape_ref":null,"effective_model_sha256":"fd7f9f659d8eae86fc3c3abb37862df313db8903f6db90fe841f3cfd099d00fd","evidence_class":"TECHNICALLY_CONFORMANT","execution":{"actual_rules_core_path":true,"authoritative_decision_boundary":"NOT_REQUIRED","direct_effect_resolution":false,"engine":"pinned-forge","environment_basis":"declared execution environment of retained run 34410975075 per pinned workflow source c03b8c5d4c75a5589723b91794494c14dac22939","overlay_basis":"retained run bound runtime pins and overlay logs (artifact 10127286824)","production_entrypoint":"forge.game.ability.AbilityUtils.resolve","production_stack_path":"trigger->MagicStack->AbilityUtils.resolve->AbilitySub.resolve","runtime_overlays_declared":true,"silent_fallbacks":0},"execution_environment_identity":{"java_version":"21-temurin","process_isolation":"GITHUB_EPHEMERAL_RUNNER_FROZEN_SOURCE","runner_os":"ubuntu-24.04"},"final_semantic_state":{"hand_actor":0,"life_actor":20,"life_opponent":20},"forge_pin":"8c7e9afb8e6caee88644b94e25da5852e36f8928","initial_semantic_state":{"hand_actor":1,"life_actor":20,"life_opponent":20},"model_base_head":"206a39cbaa3eeb98b10c2ddc36d51fe5b1b2f5ef","model_base_tree":"837f445f78bb26462653c58baf1532e294151b10","observation_evidence_ref":null,"oracle_identities":["7fffbe7f-ad78-4bb6-a611-c37e495c6ee0"],"owner_family":"ACTION_COST_DECISION","parent_ws14_primitive_ids":["forge-primitive-v1:f29840dfc7a66f9953e41aef71962789"],"patched_forge_digest":"7b65af1d174c8acd75229cb0c6817b7801d02569131f9c73505ef84b38a1e8e9","path_exercise":[{"assertion_ids":["production-child-reached-634a4b2d09d12a138afd0544c87c7d2bdb57a05a"],"exercised":true,"parent_ws14_primitive_id":"forge-primitive-v1:f29840dfc7a66f9953e41aef71962789","trace_event_ids":["PARENT_EFFECT_RESOLVED","CHILD_OBSERVED"],"v2_path_id":"forge-behavior-v2:634a4b2d09d12a138afd0544c87c7d2bdb57a05a"}],"primitive_exercise":[{"exercised":true,"primitive_id":"forge-primitive-v1:f29840dfc7a66f9953e41aef71962789"}],"qualification_source_head":"f2ae96970d8f9ce5df2dfd71782a1940be17b31d","qualification_source_tree":"76ed6a2b961362e2ec611b89c8544746faccbddc","rng_tape_ref":null,"rules_authority_refs":["https://magic.wizards.com/en/rules (current Comprehensive Rules), 603.3","https://magic.wizards.com/en/rules (current Comprehensive Rules), 608.2"],"runtime_overlay_manifest":"WS33_RUNTIME_OVERLAY_MANIFEST.json","runtime_overlay_manifest_sha256":"652899cf2cd9fe545b24f75cb2798d375a8bf3e6327f63d40aeba2b986e94e9d","schema":"commander-simulator-next.actual-card-witness.v2.1","semantic_replay_evidence_ref":null,"source_head":"c03b8c5d4c75a5589723b91794494c14dac22939","source_tree":"b3f85caf4cde9508404cb926e8ee4a71523dfb52","state_assertions":[{"actual":1,"assertion_id":"kappa-counters","expected":1,"result":"PASS"},{"actual":1,"assertion_id":"kappa-static","expected":1,"result":"PASS"},{"actual":-1,"assertion_id":"hand-net-actor","expected":-1,"result":"PASS"},{"actual":0,"assertion_id":"kappa-static-after-eot","expected":0,"result":"PASS"},{"actual":true,"assertion_id":"production-child-reached-634a4b2d09d12a138afd0544c87c7d2bdb57a05a","expected":true,"result":"PASS"}],"status":"PASS","stdout_only":false,"trace_ref":"c-promotion/adapted/ws33-c-batch-5-634a4b2d/trace.json","trace_sha256":"faec14debd280378cb14815fb5329326de638cf0fa6579c07749c8b99f582553","v2_path_ids":["forge-behavior-v2:634a4b2d09d12a138afd0544c87c7d2bdb57a05a"],"witness_id":"ws33-c-batch-5-634a4b2d","ws26_manifest_sha256":"2585a0a001a63c11e4a50a63fc163eb1050b2e8fb79549bdd7be33031eea832d"}
