{"decision_tape_ref":null,"effective_model_sha256":"56118698b535796c9194d6ea0b5a9a3e8379cd78ef73c96631dcca33bbf38c84","evidence_class":"EXTERNALLY_RULE_VALIDATED","execution":{"actual_card_execution":"PASS","actual_rules_core_path":true,"authoritative_decision_boundary":"NOT_REQUIRED","engine":"pinned-forge","engine_execution":"PASS","inheritance_basis":"immutable WS16 actual-card source-bound execution; no cosmetic rerun","inherited_run_job_artifact_refs":{"artifact_digest":"sha256:9d231f95ca45b84f170a3b7eb370a7f4aef821f7a06807840f0cb95ad41e0fd7","artifact_id":9720024348,"job_id":99148367194,"run_id":33270636779},"runtime_overlays_declared":true,"silent_fallbacks":0},"execution_environment_identity":{"java_version":"17","process_isolation":"INHERITED_IMMUTABLE_EXECUTION","runner_os":"ubuntu-24.04"},"final_semantic_state":{"controller_life":21,"simultaneous_stack_entries":false,"stack_empty":true,"tapped":true,"zone":"Battlefield"},"forge_pin":"8c7e9afb8e6caee88644b94e25da5852e36f8928","initial_semantic_state":{"card":"Jwar Isle Refuge","controller_life":20,"zone":"Hand"},"model_base_head":"206a39cbaa3eeb98b10c2ddc36d51fe5b1b2f5ef","model_base_tree":"837f445f78bb26462653c58baf1532e294151b10","observation_evidence_ref":null,"oracle_identities":["8b96f837-7c32-473a-b5ae-1d66527eaf7b"],"owner_family":"TRIGGER_REPLACEMENT_ZONE_SBA","parent_ws14_primitive_ids":["forge-primitive-v1:5f99c3f437013e47c874b90e66bc3074","forge-primitive-v1:affff0f8993d9b11ad9f1fb7cae35907"],"patched_forge_digest":"dc07da8305343711e6c05be6fa53ccb4b6daaf3577a878a77153cb6b4cdde0b8","path_exercise":[{"assertion_ids":["zone-after-move","replacement-tap"],"exercised":true,"parent_ws14_primitive_id":"forge-primitive-v1:affff0f8993d9b11ad9f1fb7cae35907","trace_event_ids":["after-move"],"v2_path_id":"forge-behavior-v2:4baa2f32c0c4c3af046a54fb027ef824bb6d33b4"},{"assertion_ids":["trigger-timing","trigger-queued-simultaneous","trigger-not-regular-early","trigger-on-regular-stack","trigger-resolution","stack-empty","simultaneous-empty"],"exercised":true,"parent_ws14_primitive_id":"forge-primitive-v1:5f99c3f437013e47c874b90e66bc3074","trace_event_ids":["after-move","trigger-collected","trigger-stacked","final"],"v2_path_id":"forge-behavior-v2:54347338c1bf4c71f825a53f10e281dabedc7f31"}],"primitive_exercise":[{"exercised":true,"primitive_id":"forge-primitive-v1:5f99c3f437013e47c874b90e66bc3074"},{"exercised":true,"primitive_id":"forge-primitive-v1:affff0f8993d9b11ad9f1fb7cae35907"}],"qualification_source_head":"206a39cbaa3eeb98b10c2ddc36d51fe5b1b2f5ef","qualification_source_tree":"837f445f78bb26462653c58baf1532e294151b10","rng_tape_ref":null,"rules_authority_refs":["https://magic.wizards.com/en/rules (current Comprehensive Rules), 614.1","https://magic.wizards.com/en/rules (current Comprehensive Rules), 603.3"],"runtime_overlay_manifest":"WS33_RUNTIME_OVERLAY_MANIFEST.json","runtime_overlay_manifest_sha256":"1fb4ab6795c0ad0e23bdaab44631837163fa0f0bf9c2a09a99c1f53c99641694","schema":"commander-simulator-next.actual-card-witness.v2.1","semantic_replay_evidence_ref":null,"source_head":"b6927c63f2dfcbc45b6357351be2828917db1a2c","source_tree":"17c90ee714d5b2512df1c1fe2872b7c236fe0078","state_assertions":[{"actual":"Battlefield","assertion_id":"zone-after-move","expected":"Battlefield","result":"PASS","semantic_path":"after_move.zone"},{"actual":true,"assertion_id":"replacement-tap","expected":true,"result":"PASS","semantic_path":"after_move.tapped"},{"actual":20,"assertion_id":"trigger-timing","expected":20,"result":"PASS","semantic_path":"after_move.controller_life"},{"actual":true,"assertion_id":"trigger-queued-simultaneous","expected":true,"result":"PASS","semantic_path":"after_trigger_collection.simultaneous_stack_entry"},{"actual":true,"assertion_id":"trigger-not-regular-early","expected":true,"result":"PASS","semantic_path":"after_trigger_collection.regular_stack_empty"},{"actual":true,"assertion_id":"trigger-on-regular-stack","expected":true,"result":"PASS","semantic_path":"after_stack_ordering.regular_stack_nonempty"},{"actual":21,"assertion_id":"trigger-resolution","expected":21,"result":"PASS","semantic_path":"final.controller_life"},{"actual":true,"assertion_id":"stack-empty","expected":true,"result":"PASS","semantic_path":"final.stack_empty"},{"actual":false,"assertion_id":"simultaneous-empty","expected":false,"result":"PASS","semantic_path":"final.simultaneous_stack_entries"}],"status":"PASS","stdout_only":false,"trace_ref":"abi/fixtures/WS26_POSITIVE_TRACE.json","trace_sha256":"19fc608325e7a4d6d372bbe8b246fefe3a23ca490e02f01f7a2a52a486cec37e","v2_path_ids":["forge-behavior-v2:4baa2f32c0c4c3af046a54fb027ef824bb6d33b4","forge-behavior-v2:54347338c1bf4c71f825a53f10e281dabedc7f31"],"witness_id":"ws33-v2.1-inherited-ws26-positive","ws26_manifest_sha256":"2585a0a001a63c11e4a50a63fc163eb1050b2e8fb79549bdd7be33031eea832d"}
